ID;Name;Brand;Image;Date;Time;Description;Price
1;Father1;Brand1;https://ipfs.infura.io/ipfs/QmSpxdVYwoDR7QSgwBTkHSWY9SJHdw8YFHijaCkWew7hWv;01/04/2022;11:30;Donec quam felis, ultricies nec, pellentesque eu, pretium quis, sem. Nulla consequat massa quis enim. Donec pede justo, fringilla vel, aliquet nec;20
2;Father2;Brand2;https://ipfs.infura.io/ipfs/QmSpxdVYwoDR7QSgwBTkHSWY9SJHdw8YFHijaCkWew7hWv;01/04/2022;11:35:00;Donec quam felis, ultricies nec, pellentesque eu, pretium quis, sem. Nulla consequat massa quis enim. Donec pede justo, fringilla vel, aliquet nec;40
3;OROLOGIO MASERATI EPOCA - R8871618013;Maserati;https://ipfs.infura.io/ipfs/QmSpxdVYwoDR7QSgwBTkHSWY9SJHdw8YFHijaCkWew7hWv;22/05/2021;16:30;L'OROLOGIO EPOCA CON CASSA 42MM, QUADRANTE E BRACCIALE BLU IN CUOIO VANTA UNO CHARME CHE SOLTANTO UN DESIGN ESCLUSIVO PUÒ EMANARE. Garanzia: 2 anni ufficiale maserati Resistenza all'acqua: 10atm.;30
4;SPEEDMASTER 57 AXIAL MASTER CHRONOMETER CHRONOGRAPH 40,5 MM;Omega;https://ipfs.infura.io/ipfs/QmSpxdVYwoDR7QSgwBTkHSWY9SJHdw8YFHijaCkWew7hWv;10/02/2020;15:45;Lo Speedmaster è uno dei segnatempo più iconici di OMEGA.  Avendo partecipato a tutte e sei le missioni lunari, questo segnatempo incarna alla perfezione lo spirito avventuroso e pionieristico del marchio. Garanzia: 5 anni ufficiale omega Resistenza all'acqua: 5atm.;35
5;DIVER 300MCO?AXIAL MASTER CHRONOMETER 42 MM;Omega;https://ipfs.infura.io/ipfs/QmSpxdVYwoDR7QSgwBTkHSWY9SJHdw8YFHijaCkWew7hWv;15/07/2020;16:00;Dal 1993, il Seamaster Professional Diver 300M vanta un numero sempre crescente di sostenitori. La collezione attuale, dallo spirito moderno, reinterpreta questa celebre tradizione marittima, offrendo al segnatempo un nuovo design e le tecnologie di punta OMEGA. Garanzia: 5 anni ufficiale omega. Resistenza all'acqua: 30atm;54
6;SUBMARINER DATE;Rolex;https://ipfs.infura.io/ipfs/QmSpxdVYwoDR7QSgwBTkHSWY9SJHdw8YFHijaCkWew7hWv;15/11/2021;15:00;Costruiti per durare, questi orologi sono caratterizzati da un’estetica inconfondibile e senza tempo. L’Oyster Perpetual Submariner è l’orologio subacqueo di riferimento. Garanzia: 5 anni ufficiale Rolex. Resistenza all'acqua: 30atm.;65
